{"acceptance":[{"evidence_schema":"mosaic.source-binding.v0.1","id":"SOURCE_EVIDENCE","obligation":"CM1:SOURCE_BOUND","required":true}],"application":{"id":"MOSAICOS.M1.UNBOUND_BINDING","name":"Mosaicos M1 Binding","version":"UNBOUND"},"authority_ceiling":{"authority_effect":"NONE","g0":"CLOSED","real_a5":false,"standing":"INFORMATION_ONLY"},"capabilities":[{"effect_class":"PURE_COMPUTATION","id":"ORIENT","request_schema":"mosaic.ucm.empty.v0.1","required":true,"result_schema":"mosaic.ucm.orientation.v0.1","route":"ucm.orient"}],"cm1":{"membership_policy":"ALL_APPLICABLE_REQUIREMENTS_PASS","requirements":[{"applicability":"REQUIRED","evidence_required":true,"id":"SOURCE_BOUND","kind":"EVIDENCE","statement":"The integration report names the exact application source.","subject_root":"0000000000000000000000000000000000000000000000000000000000000000","verifier":"AMCAS_SOURCE_BINDING_V1"},{"applicability":"REQUIRED","evidence_required":true,"id":"NO_AUTHORITY","kind":"ACCEPTANCE","statement":"No integration record grants operational authority.","subject_root":"55d9850d217137cb236958c7c4f465617fed3dd8ea5cce3ddfd94f86fc032825","verifier":"AMCAS_AUTHORITY_CEILING_V1"},{"applicability":"REQUIRED","evidence_required":true,"id":"BINDING_REQUIRED","kind":"IDENTITY","statement":"Replace all unbound roots and identities before integration work.","subject_root":"99ba1e758f9a8c450acb5d75d3ddef2e0244f01e944550ec5812a89345b4b903","verifier":"AMCAS_BINDING_COMPLETENESS_V1"}]},"cm2":{"preferences":[{"direction":"MINIMIZE","id":"SMALL_ARCHIVE","metric":"ARTIFACT_BYTES","objective":"Prefer smaller portable artifacts.","priority":1}],"selection_policy":"CM1_THEN_CM2_LEXICOGRAPHIC"},"contract_root":"248bec65dfb77ff39f1afa1db59cd5b040929c0aff3c5825fe54569b759f4df1","dependencies":[{"id":"UCM_V01","kind":"TOOL","required":true,"root":"80f1f2f8a657a0c61fa46f7edd809f9059901fbbd7e661d2b6885d19974c187c"}],"effects":[],"identities":{"agent_required":true,"delegation_required":true,"jurisdiction":{"epoch_id":null,"namespace_id":"MOSAICOS.M1.UNBOUND_BINDING","semantic_namespace":null,"universe_root":null},"possession_required":true,"session_distinct":true,"user_required":true},"integration_boundary":{"control_plane_root":"caeb476e583328e7d2f0cb9b75445d9edba95819f8dc40634973adcc4b44e77f","effect_executor":"MOSAICOS.M1.UNBOUND_BINDING.NATIVE.UNBOUND","gate_namespace":"UCM.INTEGRATION","identity_binding_status":"UNBOUND","jurisdiction_binding_status":"UNBOUND","semantic_authority":"MOSAICOS.M1.UNBOUND_BINDING.NATIVE.UNBOUND"},"integration_id":"MOSAICOS.M1.UNBOUND_BINDING.INTEGRATION","portability":{"journal_export_required":true,"offline_closure_required":true,"profiles":["SESSION_KIT","JOURNAL"]},"realization_contract":{"authority":{"authority_effect":"NONE","claim_boundary":"UNBOUND_CONFIGURATION_ONLY","release_gate":false,"self_admission":false,"standing":"INFORMATION_ONLY","track_a_dependency":"NONE"},"axes":[{"authority_effect":"NONE","continuity":"DISCRETE","default":"X64","domain":{"values":["ARM64","RISCV64","X64"]},"id":"TARGET_ISA","label":"Target instruction set","mutability":"INSTANCE","ownership":"AUTHORIAL","value_type":"ENUM"},{"authority_effect":"NONE","continuity":"DISCRETE","default":4096,"domain":{"maximum":1048576,"minimum":128},"id":"MEMORY_MIB","label":"Memory capacity","mutability":"INSTANCE","ownership":"AUTHORIAL","unit":"MiB","value_type":"INTEGER"},{"authority_effect":"NONE","continuity":"DISCRETE","default":false,"domain":{},"id":"SELF_HOSTED_AGENT","label":"Self-hosted agent environment","mutability":"INSTANCE","ownership":"AUTHORIAL","value_type":"BOOLEAN"},{"authority_effect":"NONE","continuity":"DISCRETE","default":"DISABLED","domain":{"values":["DISABLED","ETHERNET_LOCAL_ONLY"]},"id":"NETWORK_BOOTSTRAP","label":"Bootstrap transport","mutability":"INSTANCE","ownership":"AUTHORIAL","value_type":"ENUM"}],"capabilities":["ENUMERATE","VALIDATE","NORMALIZE","SELECT","LOWER","COMPARE","EXPLAIN","RECEIPT","PROJECT","TRACE"],"constraints":[{"explanation":"Memory must remain within the declared portable target envelope.","id":"MEMORY_WITHIN_PORTABLE_BOUND","kind":"BUDGET","operator":"RANGE","refusal_code":"PORTABLE_MEMORY_BOUND_REFUSED","severity":"HARD","terms":{"axis":"MEMORY_MIB","maximum":1048576,"minimum":128}},{"explanation":"The bootstrap profile remains externally driven until a later governed self-hosting transition.","id":"ETHERNET_PRECEDES_SELF_HOSTING","kind":"DEPENDENCY","operator":"REQUIRES","refusal_code":"BOOTSTRAP_SELF_HOSTING_ORDER_REFUSED","severity":"HARD","terms":{"if":{"axis":"NETWORK_BOOTSTRAP","equals":"ETHERNET_LOCAL_ONLY"},"then":{"axis":"SELF_HOSTED_AGENT","equals":false}}}],"contract_id":"UCM.PORTABLE_AGENT_ENVIRONMENT","contract_version":"0.1.0","description":"Unbound portable agent environment realization space.","evidence":{"non_claims":["NO_TARGET_ADMISSION","NO_NETWORK_AUTHORITY","NO_PRODUCTION_AUTHORITY"],"required_fields":["standing","authority_effect"],"required_roots":["CONTRACT","SUBJECT","CONFIGURATION","IMPLEMENTATION","OUTPUT"]},"lowering":{"allowed_results":["EXACT","BOUNDED","FALLBACK","LOSSY","REFUSED"],"targets":[{"adapter_version":"0.1.0","fallbacks":[],"known_losses":[],"optional_capabilities":[],"preservation_criteria":["UCM_CONTRACTS","AUTHORITY_CEILING"],"required_capabilities":[],"runtime_family":"UNBOUND","target_id":"UNBOUND_COMPUTE_TARGET"}]},"objectives":[{"direction":"MINIMIZE","measurement":"exact packaged bytes","metric_id":"ARTIFACT_BYTES","priority":100,"scope":"PORTABLE","unit":"bytes"}],"possibility":{"excluded_claims":["target admission","network permission","production readiness","real identity binding"],"intended_variation":["processor architecture","memory capacity","local agent hosting","bootstrap transport"]},"root":"6e4dfe824a1959d965a8611cc12f72535cd3018735ab9653b4fcc27cc5ec8173","schema":"mosaic.realization-space-contract.v0.1","selection":{"default_policy":"EXACT_DEFAULTS","fallback_policy":"REFUSE","policies":["EXACT_DEFAULTS","OBJECTIVE_PRIORITY"],"seed_required_for_non_unique":false},"subject":{"authority_owner":"UNBOUND","forbidden_overrides":["IDENTITY","AUTHORITY","NETWORK_AUTHORITY","PRODUCTION_ADMISSION"],"preserved_identity":["UCM_CONTRACTS","UCM_CAPABILITIES","AUTHORITY_CEILING"],"source_roots":["sha256:0000000000000000000000000000000000000000000000000000000000000000"],"subject_id":"UCM.PORTABLE_AGENT_ENVIRONMENT","subject_schema":"mosaic.ucm.portable-agent-environment.v0.1"}},"reporting":{"progress_channel":"NONSEMANTIC_JSONL_V1","required_sections":["requirements","capabilities","operations","findings","limitations","portable_artifacts"]},"schema":"mosaic.amcas.integration-contract.v0.2","subject":{"manifest_root":"0000000000000000000000000000000000000000000000000000000000000000","path_policy":"PORTABLE_POSIX_RELATIVE_V1","source_root":"0000000000000000000000000000000000000000000000000000000000000000"}}